human_id,wikidata_id
"Integrated analyses of single-cell atlases reveal age, gender, and smoking status associations with cell type-specific expression of mediators of SARS-CoV-2 viral entry and highlights inflammatory programs in putative target cells",Q95602580
Single-cell atlas of a non-human primate reveals new pathogenic mechanisms of COVID-19,Q95607654
Benchmarking single-cell RNA-sequencing protocols for cell atlas projects,Q96230190
A Single-cell Atlas of the Human Healthy Airways,Q98162195
BioCreative V BioC track overview: collaborative biocurator assistant task for BioGRID.,Q36121943
The BEL information extraction workflow (BELIEF): evaluation in the BioCreative V BEL and IAT track.,Q41265068
"STRING v11: protein–protein association networks with increased coverage, supporting functional discovery in genome-wide experimental datasets",Q60469724
Unsupervised word embeddings capture latent knowledge from materials science literature,Q91595456
Artificial intelligence in neurodegenerative disease research: use of IBM Watson to identify additional RNA-binding proteins altered in amyotrophic lateral sclerosis.,Q47406275
"The STRING database in 2021: customizable protein-protein networks, and functional characterization of user-uploaded gene/measurement sets",Q102383784
High throughput error corrected Nanopore single cell transcriptome sequencing,Q98394753
Myocyte Specific Upregulation of ACE2 in Cardiovascular Disease: Implications for SARS-CoV-2 Mediated Myocarditis,Q98468904
Crowdsourcing in biomedicine: challenges and opportunities,Q19857267
Crowdsourcing and curation: perspectives from biology and natural language processing,Q28598176
The Human and Mouse Enteric Nervous System at Single-Cell Resolution,Q98952972
The Human Cell Atlas and equity: lessons learned,Q100491106
SARS-CoV-2 receptor networks in diabetic and COVID-19 associated kidney disease,Q100513994
Wikidata and Libraries: Facilitating Open Knowledge,Q52235186
OpenTapioca: Lightweight Entity Linking for Wikidata,Q63278360
Single nucleus and in situ RNA sequencing reveals cell topographies in the human pancreas,Q102206138
Single-Cell Sequencing of Developing Human Gut Reveals Transcriptional Links to Childhood Crohn's Disease,Q104130336
The COVID-19 Ontology,Q104513823
How to describe a new fungal species,Q28730060
Uberon: towards a comprehensive multi-species anatomy ontology,Q57006348
"TELOCYTES - a case of serendipity: the winding way from Interstitial Cells of Cajal (ICC), via Interstitial Cajal-Like Cells (ICLC) to TELOCYTES.",Q42914236
Gramene 2021: harnessing the power of comparative genomics and pathways for plant research,Q101556384
From ArrayExpress to BioStudies,Q102205732
"Longitudinal Multi-omics Analyses Identify Responses of Megakaryocytes, Erythroid Cells, and Plasmablasts as Hallmarks of Severe COVID-19",Q104139713
The Organoid Cell Atlas: A Rosetta Stone for Biomedical Discovery and Regenerative Therapy,Q104450592
Tumor to normal single-cell mRNA comparisons reveal a pan-neuroblastoma cancer cell,Q106642644
The fasciacytes: A new cell devoted to fascial gliding regulation.,Q52724376
Openness and trust in data-intensive science: the case of biocuration,Q96307475
UniBioDicts: Unified access to biological dictionaries,Q104582202
IMGT<sup>®</sup> Biocuration and Comparative Analysis of <i>Bos taurus</i> and <i>Ovis aries</i> TRA/TRD Loci,Q104619923
Setting the basis of best practices and standards for curation and annotation of logical models in biology-highlights of the [BC]2 2019 CoLoMoTo/SysMod Workshop,Q92104055
"Pancreatic ductal cells in development, regeneration, and neoplasia",Q27006729
Creating a Metabolic Syndrome Research Resource using the National Health and Nutrition Examination Survey,Q104684400
Quality Matters: Biocuration Experts on the Impact of Duplication and Other Data Quality Issues in Biological Databases,Q97537095
Retinoic acid synthesis by a population of choroidal stromal cells,Q99604056
The Functionally Unannotated Proteome of Human Male Tissues: A Shared Resource to Uncover New Protein Functions Associated with Reproductive Biology,Q100676469
CARD 2020: antibiotic resistome surveillance with the comprehensive antibiotic resistance database,Q91006744
Integrating image caption information into biomedical document classification in support of biocuration,Q91956285
Single-cell RNA-seq analysis of human coronary arteries using an enhanced workflow reveals SMC transitions and candidate drug targets,Q106659158
Atheroprotective roles of smooth muscle cell phenotypic modulation and the TCF21 disease gene as revealed by single-cell analysis,Q92267490
Deciphering cell-cell interactions and communication from gene expression,Q101476452
"Besca, a single-cell transcriptomics analysis toolkit to accelerate translational research | bioRxiv",Q104450593
Plant Reactome: a knowledgebase and resource for comparative pathway analysis,Q91078214
Deep learning and alignment of spatially-resolved whole transcriptomes of single cells in the mouse brain with Tangram | bioRxiv,Q104450595
Delayed viral clearance and exacerbated airway hyperinflammation in hypertensive COVID-19 patients,Q104450596
Hypertension delays viral clearance and exacerbates airway hyperinflammation in patients with COVID-19,Q106686666
Using Reactome to build an autophagy mechanism knowledgebase,Q96120967
Involving community in genes and pathway curation,Q61447691
"Open data, open curation",Q56885165
A mechanosensitive peri-arteriolar niche for osteogenesis and lymphopoiesis,Q106692362
DUBStepR: correlation-based feature selection for clustering single-cell RNA sequencing data,Q104450599
Ten quick tips for biocuration,Q64071693
Interpretable Clinical Genomics with a Likelihood Ratio Paradigm,Q98208987
Building deep learning models for evidence classification from the open access biomedical literature,Q64084067
Aristóteles e o estudo dos seres vivos,Q106693249
"Applying citizen science to gene, drug and disease relationship extraction from biomedical abstracts",Q90025338
Consensus transcriptional regulatory networks of coronavirus-infected human cells,Q99608377
Worming into the Uncharacterized Human Proteome,Q90091195
IMGT® Biocuration and Comparative Study of the T Cell Receptor Beta Locus of Veterinary Species Based on Homo sapiens TRB,Q95293653
UPCLASS: a deep learning-based classifier for UniProtKB entry publications,Q94522302
Integrated single cell analysis of human lung fibrosis resolves cellular origins of predictive protein signatures in body fluids,Q104450603
Poised cell circuits in human skin are activated in disease,Q104450608
An autonomous debating system,Q106097217
Protein Data Bank: the single global archive for 3D macromolecular structure data,Q57793805
PubTator central: automated concept annotation for biomedical full text articles,Q92202965
Sampling artifacts in single-cell genomics cohort studies,Q104450612
Single cell profiling of immature human postnatal thymocytes resolves the complexity of intra-thymic lineage differentiation and thymus seeding precursors,Q104450621
Spatial and single-cell transcriptional landscape of human cerebellar development,Q104450624
The unipolar brush cell: a remarkable neuron finally receiving deserved attention,Q30471584
"The Terminologia Histologica after 10 years: Inconsistencies, mistakes, and new proposals",Q58049549
Towards a Terminologia Neuroanatomica.,Q36210969
Cell segmentation-free inference of cell types from in situ transcriptomics data,Q104450627
Deep generative model embedding of single-cell RNA-Seq profiles on hyperspheres and hyperbolic spaces,Q104450629
Q106777072,Q106777072
interacCircos: an R package based on JavaScript libraries for the generation of interactive circos plots,Q106777072
Q106777073,Q106777073
Q10677707,Q10677707
"Quickomics: exploring omics data in an intuitive, interactive and informative manner",Q106777073
PrInCE: an R/Bioconductor package for protein–protein interaction network inference from co-fractionation mass spectrometry data,Q106777074
IRIS-FGM: an integrative single-cell RNA-Seq interpretation system for functional gene module analysis,Q106777075
"Gene Tracer: A smart, interactive, voice-controlled Alexa skill for gene information retrieval and browsing, mutation annotation, and network visualization",Q106777076
Gene Teller: An Extensible Alexa Skill for Gene-Relevant Databases,Q98613961
Gene set inference from single-cell sequencing data using a hybrid of matrix factorization and variational autoencoders,Q104450631
Single cell transcriptome atlas of immune cells in human small intestine and in celiac disease,Q104450637
Terminologia Histologica 10 years on: some disputable terms in need of discussion and recent developments,Q92078001
Terminologia Histologica: International Terms for Human Cytology and Histology,Q106787216
The Human Cell Atlas White Paper,Q104450645
The cellular immune response to COVID-19 deciphered by single cell multi-omics across three UK centres,Q106272047
Machine Learning to Support the Presentation of Complex Pathway Graphs,Q93101366
Ten years of CAZypedia: a living encyclopedia of carbohydrate-active enzymes.,Q47639378
The local and systemic response to SARS-CoV-2 infection in children and adults,Q106272048
Mapping the musculoskeletal system one cell at a time,Q106272049
Modeling the pasture-associated severe equine asthma bronchoalveolar lavage fluid proteome identifies molecular events mediating neutrophilic airway inflammation,Q64072479
Biocuration: Distilling data into knowledge.,Q52586099
Future of Evidence Synthesis in Precision Oncology: Between Systematic Reviews and Biocuration,Q92594838
Robust clustering and interpretation of scRNA-seq data using reference component analysis,Q106272050
"Shotgun transcriptome, spatial omics, and isothermal profiling of SARS-CoV-2 infection reveals unique host responses, viral diversification, and drug interactions",Q106272052
Improved annotation of the insect vector of citrus greening disease: biocuration by a diverse genomics community,Q64075749
"RCSB Protein Data Bank: biological macromolecular structures enabling research and education in fundamental biology, biomedicine, biotechnology and energy",Q57793773
Systemic Tissue and Cellular Disruption from SARS-CoV-2 Infection revealed in COVID-19 Autopsies and Spatial Omics Tissue Maps,Q106272053
Science not art: statistically sound methods for identifying subsets in multi-dimensional flow and mass cytometry data sets.,Q47263573
"Karl Touton and his ""xanthelasmatic giant cell."" A selective review of multinucleated giant cells.",Q34164972
High-Precision Extraction of Emerging Concepts from Scientific Literature,Q106831968
RCSB Protein Data Bank tools for 3D structure-guided cancer research: human papillomavirus (HPV) case study,Q99557412
Systematic tissue annotations of –omics samples by modeling unstructured metadata,Q106833747
Large field of view-spatially resolved transcriptomics at nanoscale resolution,Q106648171
Putative cell type discovery from single-cell gene expression data,Q95328107
Worldwide Protein Data Bank biocuration supporting open access to high-quality 3D structural biology data.,Q50290407
"Applying Citizen Science to Gene, Drug, Disease Relationship Extraction from Biomedical Abstracts",Q63640419
Negative Knowledge for Open-world Wikidata,Q106630248
Wikidata and the Bibliography of Life,Q106727511
The Organoid Cell Atlas,Q106686809
The antral clear cell--a new cell type discovered in the pyloric-antral mucosa of the ferret,Q71273935
A resource to explore the discovery of rare diseases and their causative genes,Q106708178
"Community curation in PomBase: enabling fission yeast experts to provide detailed, standardized, sharable annotation from research publications",Q94470608
Single-cell RNA-seq analysis reveals the progression of human osteoarthritis,Q90348985
Cell-type-specific gene expression patterns in the knee cartilage in an osteoarthritis rat model.,Q49169602
Defining life: synthesis and conclusions.,Q47407732
Single-cell transcriptomic analysis of Alzheimer's disease,Q91668217
The single-cell transcriptional landscape of mammalian organogenesis,Q91763046
Is defining life pointless? Operational definitions at the frontiers of biology,Q106876268
Community-driven roadmap for integrated disease maps.,Q52311286
Collective intelligence defines biological functions in Wikipedia as communities in the hidden protein connection network,Q89759189
Functionally distinct NKT cell subsets and subtypes.,Q42972264
The neuropeptide NMU amplifies ILC2-driven allergic lung inflammation.,Q47095124
Moonlight: a tool for biological interpretation and driver genes discovery,Q62566491
Ontological Organization and Bioinformatic Analysis of Adverse Drug Reactions From Package Inserts: Development and Usability Study,Q97685936
Single-cell and spatial transcriptomics reveal somitogenesis in gastruloids,Q89792286
The microbiota regulate neuronal function and fear extinction learning,Q90911578
Cell stress in cortical organoids impairs molecular subtype specification,Q93040438
Early emergence of cortical interneuron diversity in the mouse embryo.,Q50422244
CNSA: a data repository for archiving omics data,Q97683003
Improving the Gene Ontology Resource to Facilitate More Informative Analysis and Interpretation of Alzheimer’s Disease Data,Q59538811
Synthetic DNA and biosecurity: Nuances of predicting pathogenicity and the impetus for novel computational approaches for screening oligonucleotides,Q98223660
Gene Ontology Curation of Neuroinflammation Biology Improves the Interpretation of Alzheimer's Disease Gene Expression Data,Q94954393
Structure of the Pandemic,Q98209024
Exploring the Uncharacterized Human Proteome Using neXtProt,Q56815361
Defining the earliest step of cardiovascular lineage segregation by single-cell RNA-seq.,Q48163564
Microglia development follows a stepwise program to regulate brain homeostasis.,Q48659057
Ontologies for biologists: a community model for the annotation of genomic data.,Q30955349
Are the current ontologies in biology good ontologies?,Q38519864
Single-cell transcriptomics reveals bimodality in expression and splicing in immune cells,Q29617430
Single-cell transcriptomes of the regenerating intestine reveal a revival stem cell,Q90284294
Outlier analyses of the Protein Data Bank archive using a probability-density-ranking approach,Q59789431
Improving biocuration of microRNAs in diseases: a case study in idiopathic pulmonary fibrosis.,Q33787495
The cellular basis of distinct thirst modalities,Q100560052
Biocuration in the structure-function linkage database: the anatomy of a superfamily.,Q54898134
Clinical validity of expanded carrier screening: evaluating the gene-disease relationship in more than 200 conditions,Q94558276
An overview of the BIOASQ large-scale biomedical semantic indexing and question answering competition,Q28646342
A unifying concept: the history of cell theory,Q22122311
Single-cell transcriptomics reveals receptor transformations during olfactory neurogenesis.,Q34674303
"OneDep: Unified wwPDB System for Deposition, Biocuration, and Validation of Macromolecular Structures in the PDB Archive",Q28950350
Three-dimensional intact-tissue sequencing of single-cell transcriptional states,Q59753943
"Textpresso Central: a customizable platform for searching, text mining, viewing, and curating biomedical literature.",Q53838636
Developmental diversification of cortical inhibitory interneurons.,Q50420532
A single-cell RNA-seq survey of the developmental landscape of the human prefrontal cortex.,Q52655768
Cyberinfrastructure and resources to enable an integrative approach to studying forest trees,Q92358532
AgBioData consortium recommendations for sustainable genomics and genetics databases for agriculture,Q56655129
From Wikidata to Scholia: creating structured linked data to generate scholarly profiles,Q106987670
Validation of Structures in the Protein Data Bank.,Q46645138
PubMed Text Similarity Model and its application to curation efforts in the Conserved Domain Database,Q91566046
Deconstructing transcriptional heterogeneity in pluripotent stem cells,Q41730518
A single-cell molecular map of mouse gastrulation and early organogenesis,Q91763038
"A Comparison of Whole Genome Sequencing of SARS-CoV-2 Using Amplicon-Based Sequencing, Random Hexamers, and Bait Capture",Q98618031
Science Is Shaped by Wikipedia: Evidence from a Randomized Control Trial,Q42013239
Non-equivalence of Wnt and R-spondin ligands during Lgr5+ intestinal stem-cell self-renewal,Q42509225
"The Signaling Pathways Project, an integrated 'omics knowledgebase for mammalian cellular signaling pathways",Q91044884
A molecular single-cell lung atlas of lethal COVID-19,Q107128138
CD16 is indispensable for antibody-dependent cellular cytotoxicity by human monocytes,Q27341786
Tutorial: guidelines for annotating single-cell transcriptomic maps using automated and manual methods,Q107158224
Best Practices in Manual Annotation with the Gene Ontology.,Q38440697
Expanding the horizons of microRNA bioinformatics,Q58161139
"User-friendly, scalable tools and workflows for single-cell RNA-seq analysis",Q107158223
Single-Cell Sequencing of Peripheral Mononuclear Cells Reveals Distinct Immune Response Landscapes of COVID-19 and Influenza Patients,Q98388192
Hydroxychloroquine Inhibits the Trained Innate Immune Response to Interferons,Q104617060
Announcing mandatory submission of PDBx/mmCIF format files for crystallographic depositions to the Protein Data Bank (PDB),Q64111054
Mouse Genome Database (MGD): Knowledgebase for mouse-human comparative biology,Q102372282
Regenerative potential of prostate luminal cells revealed by single-cell analysis,Q94473592
Phenotypic variation of transcriptomic cell types in mouse motor cortex,Q102054102
Toward a conceptual framework for biology.,Q37797379
Wiki2Prop: A Multimodal Approach for Predicting Wikidata Properties from Wikipedia,Q107230303
High-affinity allergen-specific human antibodies cloned from single IgE B cell transcriptomes,Q60128972
"Single-cell RNA-seq reveals dynamic, random monoallelic gene expression in mammalian cells.",Q42774504
"ECO, the Evidence & Conclusion Ontology: community standard for evidence information",Q58587002
Computational strategies to combat COVID-19: useful tools to accelerate SARS-CoV-2 and coronavirus research,Q101222862
Systematic Analysis of Primary Sequence Domain Segments for the Discrimination Between Class C GPCR Subtypes.,Q49826285
RegulonDB v 10.5: tackling challenges to unify classic and high throughput knowledge of gene regulation in E. coli K-12,Q58611639
Drug repositioning for psychiatric and neurological disorders through a network medicine approach,Q94600062
Multi-label Deep Learning for Gene Function Annotation in Cancer Pathways.,Q47555736
Citizen Science for Mining the Biomedical Literature,Q56992710
Single-cell RNA-seq reveals dynamic paracrine control of cellular variation.,Q35185544
Characterization of a common progenitor pool of the epicardium and myocardium,Q104794656
Genetic and transcriptional evolution alters cancer cell line drug response,Q56550183
Single-cell RNA-seq supports a developmental hierarchy in human oligodendroglioma.,Q42774833
HPIDB 2.0: a curated database for host-pathogen interactions.,Q37060118
Big data - a 21st century science Maginot Line? No-boundary thinking: shifting from the big data paradigm.,Q30891300
No-boundary thinking in bioinformatics research.,Q37308031
A Knowledge Graph of Combined Drug Therapies Using Semantic Predications From Biomedical Literature: Algorithm Development,Q93337500
UniProt: a worldwide hub of protein knowledge,Q58611634
KnowLife: a versatile approach for constructing a large knowledge graph for biomedical sciences,Q28646868
HighLife: Higher-arity Fact Harvesting,Q52160105
Focused Query Expansion with Entity Cores for Patient-Centric Health Search,Q101086678
HER2 expression identifies dynamic functional states within circulating breast cancer cells.,Q37510512
Tracing haematopoietic stem cell formation at single-cell resolution.,Q38862522
Massively parallel single-cell RNA-seq for marker-free decomposition of tissues into cell types.,Q34404570
Cryopreservation of human cancers conserves tumour heterogeneity for single-cell multi-omics analysis,Q107301506
“Lmo-2 interacts with Elf-2 ” On the Meaning of Common Statements in Biomedical Literature,Q107297378
The Next Big Thing: From Hypermedia to Datuments,Q107297383
Cell diversity and network dynamics in photosensitive human brain organoids.,Q42615577
A conserved dendritic-cell regulatory program limits antitumour immunity,Q91739840
A molecular atlas of cell types and zonation in the brain vasculature.,Q50001722
Spatiotemporal gene expression trajectories reveal developmental hierarchies of the human cortex.,Q46852287
GARLIC: a bioinformatic toolkit for aetiologically connecting diseases and cell type-specific regulatory maps.,Q42290203
Micropublication: incentivizing community curation and placing unpublished data into the public domain.,Q54963746
The Reactome pathway knowledgebase,Q91135284
The dynamics of gene expression in vertebrate embryogenesis at single-cell resolution.,Q52560248
Single-cell analysis of mixed-lineage states leading to a binary cell fate choice.,Q37510607
Diversity of developing peripheral glia revealed by single cell RNA sequencing,Q107332851
Disease Ontology: a backbone for disease semantic integration.,Q34029365
MetaSRA: normalized human sample-specific metadata for the Sequence Read Archive.,Q36378619
Minimum information about a microarray experiment (MIAME)-toward standards for microarray data,Q27860569
Developmental and oncogenic programs in H3K27M gliomas dissected by single-cell RNA-seq.,Q52718178
Single-Cell RNA Sequencing Reveals a Dynamic Stromal Niche That Supports Tumor Growth,Q95325987
Dissecting direct reprogramming from fibroblast to neuron using single-cell RNA-seq,Q37056065
Ontology-based annotations and semantic relations in large-scale (epi)genomics data,Q31090008
ALE: automated label extraction from GEO metadata.,Q47104084
Precision annotation of digital samples in NCBI's gene expression omnibus.,Q41678419
Ontology-aware classification of tissue and cell-type signals in gene expression profiles across platforms and technologies.,Q37327539
Lineage-dependent spatial and functional organization of the mammalian enteric nervous system.,Q47320490
"Anatomical Structures, Cell Types, and Biomarkers Tables Plus 3D Reference Organs in Support of a Human Reference Atlas",Q107363147
Cell types and ontologies of the Human Cell Atlas,Q107373831
The Neuron Phenotype Ontology: A FAIR Approach to Proposing and Classifying Neuronal Types,Q107380389
"Embryo-scale, single-cell spatial transcriptomics",Q107398398
Real-time tagging of biomedical entities,Q29169597
"SciCrunch: A Cooperative And Collaborative Data, Information, And Resource Discovery Portal For Scientific Communities",Q57271337
Predicting biomedical metadata in CEDAR: A study of Gene Expression Omnibus (GEO).,Q38720319
Guidelines for writing definitions in ontologies,Q107380429
Single-cell meta-analysis of SARS-CoV-2 entry genes across tissues and demographics,Q107272539
"Neuroendocrine cells of the prostate: Histology, biological functions, and molecular mechanisms",Q107448777
A Study of the Quality of Wikidata,Q107425133
Cross-tissue immune cell analysis reveals tissue-specific adaptations and clonal architecture across the human body,Q107363182
Understanding human gut diseases at single-cell resolution,Q96690191
Lineage tracing on transcriptional landscapes links state to fate during differentiation,Q92888602
Extraction and analysis of signatures from the Gene Expression Omnibus by the crowd.,Q37315128
Spatial and temporal heterogeneity of mouse and human microglia at single-cell resolution,Q91560057
Decoding the development of the human hippocampus,Q92669541
The interaction of domain knowledge and linguistic structure in natural language processing: interpreting hypernymic propositions in biomedical text.,Q31040294
Constructing a semantic predication gold standard from the biomedical literature.,Q34106676
Broad-coverage biomedical relation extraction with SemRep,Q94917474
Shared evolutionary origin of vertebrate neural crest and cranial placodes,Q59090070
Single-cell reconstruction of developmental trajectories during zebrafish embryogenesis,Q60468467
Scalable representations of diseases in biomedical ontologies.,Q38490266
On beyond Gruber: “Ontologies” in today’s biomedical information systems and the limits of OWL,Q107542982
The bone marrow microenvironment at single-cell resolution,Q93012764
A human cell atlas of fetal gene expression,Q102053616
Neuronal subtypes and diversity revealed by single-nucleus RNA sequencing of the human brain.,Q37288678
Reactome and the Gene Ontology: digital convergence of data resources,Q107542983
Bio4j: a high-performance cloud-enabled graph-based data platform,Q107297394
Somatic mutations and cell identity linked by Genotyping of Transcriptomes,Q91595285
"EDAM: an ontology of bioinformatics operations, types of data and identifiers, topics and formats",Q30597346
Single-cell analysis reveals T cell infiltration in old neurogenic niches,Q91595293
"Search, access, and explore life science nanopublications on the Web",Q107297395
Aging increases cell-to-cell transcriptional variability upon immune stimulation,Q42144472
Knowledge Graphs 2021: A Data Odyssey,Q108272323
Genetic programs in human and mouse early embryos revealed by single-cell RNA sequencing.,Q34360246
Childhood cerebellar tumours mirror conserved fetal transcriptional programs,Q91676982
Suporte ao desenvolvimento e à integração de ontologias no domínio biomédico,Q107297538
Diabetes relief in mice by glucose-sensing insulin-secreting human α-cells.,Q64903100
Creating and Querying Personalized Versions of Wikidata on a Laptop,Q108208862
