human_id,wikidata_id
Haematopoietic stem and progenitor cells from human pluripotent stem cells.,Q40198119
Q59071038,Q59071038
Identification of a regeneration-organizing cell in the Xenopus tail,Q63979660
ROBOT: A Tool for Automating Ontology Workflows,Q92260004
IL-11 is a crucial determinant of cardiovascular fibrosis.,Q46257233
"k-BOOM: A Bayesian approach to ontology structure inference, with applications in disease ontology construction",Q56975984
Which methods are the most effective in enabling novice users to participate in ontology creation? A usability study,Q107338764
Cell type atlas and lineage tree of a whole complex animal by single-cell transcriptomics.,Q52315063
A revised airway epithelial hierarchy includes CFTR-expressing ionocytes,Q57318688
Centralizing content and distributing labor: a community model for curating the very long tail of microbial genomes,Q21503281
Ontology-driven integrative analysis of omics data through Onassis,Q92783288
Single-cell mapping of the thymic stroma identifies IL-25-producing tuft epithelial cells,Q59066334
Joint profiling of chromatin accessibility and gene expression in thousands of single cells.,Q59770869
ContentMine/Hypothes.is Proposal,Q28650425
Neuronal vulnerability and multilineage diversity in multiple sclerosis,Q91969373
Wikidata from a Research Perspective -- A Systematic Mapping Study of Wikidata,Q66858157
Myeloid progenitor cluster formation drives emergency and leukaemic myelopoiesis.,Q41667192
Key biology databases go wiki,Q28288308
Ten recommendations for supporting open pathogen genomic analysis in public health,Q96302881
Overview of BioASQ 2021: The Ninth BioASQ Challenge on Large-Scale Biomedical Semantic Indexing and Question Answering,Q108784005
The Molecule Pages database.,Q34164196
Synovial fibroblasts: key players in rheumatoid arthritis.,Q36433286
Democratic databases: science on GitHub,Q30490138
Comparative transcriptomics of primary cells in vertebrates,Q97903250
