human_id,wikidata_id
Representation of probabilistic scientific knowledge.,Q36786073
An atlas of active enhancers across human cell types and tissues.,Q34660689
A promoter-level mammalian expression atlas,Q34412203
Cell type-specific genetic regulation of gene expression across human tissues,Q99349840
xCell: digitally portraying the tissue cellular heterogeneity landscape.,Q46377913
"Identifying cell types to interpret scRNA-seq data: how, why and more possibilities",Q90784336
Models of global gene expression define major domains of cell type and tissue identity,Q33558314
Building a high-quality Human Cell Atlas,Q105080655
scMatch: a single-cell gene expression profile annotation tool using reference datasets,Q91557912
A protocol for adding knowledge to Wikidata: aligning resources on human coronaviruses,Q105037759
Automating drug discovery.,Q47780833
Conceptions of Good Science in Our Data-Rich World.,Q55214531
On the formalization and reuse of scientific research.,Q34178056
A subcellular map of the human proteome.,Q48155823
"Representation, simulation, and hypothesis generation in graph and logical models of biological networks.",Q37921686
The EXACT description of biomedical protocols.,Q38513299
The Bari Manifesto: An interoperability framework for essential biodiversity variables,Q60250756
"The Philosophy of Logical Atomism, Lecture 1: Facts and Propositions",Q105105637
Transcriptomes of the major human pancreatic cell types.,Q37430849
Variability and memory of protein levels in human cells.,Q40205119
scConsensus: combining supervised and unsupervised clustering for cell type identification in single-cell RNA sequencing data,Q104450617
Study of cell differentiation by phylogenetic analysis using histone modification data,Q30841360
Evaluation of text-mining systems for biology: overview of the Second BioCreative community challenge.,Q34844839
Q,Q
Topic pages: PLoS Computational Biology meets Wikipedia,Q21092570
Submit a Topic Page to PLOS Computational Biology and Wikipedia,Q54655231
Genomic and molecular control of cell type and cell type conversions.,Q49436822
"Inferring cell type innovations by phylogenetic methods-concepts, methods, and limitations.",Q40436539
From Freebase to Wikidata: The Great Migration,Q24074986
What Makes a Good Collaborative Knowledge Graph: Group Composition and Quality in Wikidata,Q38918394
Single-cell sequencing-based technologies will revolutionize whole-organism science.,Q34360540
Model-based understanding of single-cell CRISPR screening,Q64052031
Reference-based analysis of lung single-cell sequencing reveals a transitional profibrotic macrophage,Q91045816
"Strategic reading, ontologies, and the future of scientific publishing.",Q33493284
Geospatial data and Scholia,Q50813856
SuperCT: a supervised-learning framework for enhanced characterization of single-cell transcriptomic profiles,Q64106229
Principles of Cell Circuits for Tissue Repair and Fibrosis,Q89717434
WikiGenomes: an open Web application for community consumption and curation of gene annotation data in Wikidata,Q28529449
Towards Robot Scientists for autonomous scientific discovery.,Q21198755
Single-cell RNA sequencing reveals the heterogeneity of liver-resident immune cells in human,Q94464890
Cell Atlas of The Human Fovea and Peripheral Retina,Q96576585
Wikidata: A Free Collaborative Knowledgebase,Q18507561
Biotea: semantics for Pubmed Central.,Q47191940
Making Linked Data SPARQL with the InterMine Biological Data Warehouse,Q58881147
Cell-type deconvolution from DNA methylation: a review of recent applications.,Q47661868
Cell-type-specific programs for activity-regulated gene expression,Q90360171
Learning for single-cell assignment,Q101132241
Droplet scRNA-seq is not zero-inflated,Q92644135
Circular RNA expression in human hematopoietic cells is widespread and cell-type specific,Q58779756
scReClassify: post hoc cell type classification of single-cell rNA-seq data,Q92237112
Microparadigms: chains of collective reasoning in publications about molecular interactions.,Q34451887
Seeking a new biology through text mining.,Q42220103
Extraction of relations between genes and diseases from text and large-scale data analysis: implications for translational research,Q21146739
TOAST: improving reference-free cell composition estimation by cross-cell type differential analysis,Q93103927
Cell-type-resolved alternative splicing patterns in mouse liver.,Q50084595
Modularisation of domain ontologies implemented in description logics and related formalisms including OWL,Q29027414
Categorization of services for seeking information in biomedical literature: a typology for improvement of practice.,Q40065967
Scrutinizing SNOMED CT's Ability to Reconcile Clinical Language Ambiguities with an Ontology Representation,Q95522960
alona: a web server for single cell RNA-seq analysis,Q93179879
The selection and function of cell type-specific enhancers,Q28081960
Scale and context: issues in ontologies to link health- and bio-informatics.,Q38431134
Using the wisdom of the crowds to find critical errors in biomedical ontologies: a study of SNOMED CT.,Q38262429
scSLAM-seq reveals core features of transcription dynamics in single cells,Q91776830
Slide-seq: A scalable technology for measuring genome-wide expression at high spatial resolution,Q92687649
A review of the semantic web field,Q105079960
"Towards a Systematic Approach to Sync Factual Data across Wikipedia, Wikidata and External Data Sources",Q105428190
Discovering pathway and cell-type signatures in transcriptomic compendia with machine learning,Q57897434
Computational methods for the integrative analysis of single-cell data,Q94503935
DBpedia FlexiFusion the Best of Wikipedia > Wikidata > Your Data,Q87813149
OSCAR4: a flexible architecture for chemical text-mining,Q27062470
Moana: A robust and scalable cell type classification framework for single-cell RNA-Seq data,Q105394114
"Bias, robustness and scalability in single-cell differential expression analysis",Q56879991
Cell-type deconvolution in epigenome-wide association studies: a review and recommendations.,Q39314677
Text processing through Web services: calling Whatizit.,Q38514993
Why do it the hard way? The case for an expressive description logic for SNOMED,Q28292343
Comparison of concept recognizers for building the Open Biomedical Annotator.,Q33504367
Wikidata through the eyes of DBpedia,Q87813191
Wikidata through the Eyes of DBpedia,Q27036443
"A comprehensive, cell specific microRNA catalogue of human peripheral blood.",Q47678818
CNS microRNA profiles: a database for cell type enriched microRNA expression across the mouse central nervous system,Q90438547
Regulation of cell-type-specific transcriptomes by microRNA networks during human brain development,Q93223327
[What is a pancreatic stem cell?],Q73867340
BioPortal: ontologies and integrated data resources at the click of a mouse,Q29617519
Identification of SARS-CoV-2 Inhibitors using Lung and Colonic Organoids,Q101051356
Decoding myofibroblast origins in human kidney fibrosis,Q101569793
Distinct hypothalamic control of same- and opposite-sex mounting behaviour in mice,Q103836863
Machine learning for rediscovering revolutionary ideas of the past,Q105302822
Scientific intuition inspired by machine learning generated hypotheses,Q105516701
"Tacit Knowledge, Trust and the Q of Sapphire",Q105516720
Towards Operational Abduction from a Cognitive Perspective,Q105516744
Undiscovered Public Knowledge,Q105516839
Neurotoxic microglia promote TDP-43 proteinopathy in progranulin deficiency,Q99634613
Cells of the adult human heart,Q99708572
Systems biological assessment of immunity to mild versus severe COVID-19 infection in humans,Q98394258
Simultaneous epitope and transcriptome measurement in single cells.,Q42595570
Google Scholar to overshadow them all? Comparing the sizes of 12 academic search engines and bibliographic databases,Q58898255
Academic Search Engine Optimization (ASEO),Q56506009
Thalia: Semantic search engine for biomedical abstracts,Q57452795
GoWeb: A Semantic Search Engine for the Life Science Web,Q58914760
BioSearch: a semantic search engine for Bio2RDF.,Q47268720
Mapping anatomical related entities to human body parts based on wikipedia in discharge summaries,Q87818346
"Hypothesis, analysis and synthesis, it's all Greek to me",Q64261830
Preliminary evaluation of the CellFinder literature curation pipeline for gene expression in kidney cells and anatomical parts.,Q36776925
Ontology based molecular signatures for immune cell types via gene expression analysis,Q34978215
Identification of research hypotheses and new knowledge from scientific literature.,Q55440752
Enriching a biomedical event corpus with meta-knowledge annotation.,Q31033181
SciLite: a platform for displaying text-mined annotations as a means to link research articles with biological data.,Q41695166
EXTRACT: interactive extraction of environment metadata and term suggestion for metagenomic sample annotation,Q29169641
In defence of classification,Q57945379
Regulatory logic of neuronal diversity: terminal selector genes and selector motifs.,Q37068535
Molecular taxonomy of major neuronal classes in the adult mouse forebrain,Q28288068
Europe PMC in 2017.,Q47121112
Reflect: A practical approach to web semantics,Q30002409
Aggregating transcript-level analyses for single-cell differential gene expression,Q96127495
Single-cell landscape of bronchoalveolar immune cells in patients with COVID-19,Q94600823
EXTRACT 2.0: text-mining-assisted interactive annotation of biomedical named entities and ontology terms,Q30002333
biochem4j: Integrated and extensible biochemical knowledge through graph databases.,Q38678861
Comprehensive Integration of Single-Cell Data,Q92614138
Text mining and its potential applications in systems biology.,Q36625511
Improving reference prioritisation with PICO recognition,Q91728644
Toward systematic review automation: a practical guide to using machine learning tools in research synthesis,Q91804991
"Genes and homology in nervous system evolution: comparing gene functions, expression patterns, and cell type molecular fingerprints.",Q36625916
"Character trees from transcriptome data: Origin and individuation of morphological characters and the so-called ""species signal"".",Q30980445
Master transcription factors determine cell-type-specific responses to TGF-β signaling,Q28586183
Regulatory Logic of Pan-Neuronal Gene Expression in C. elegans.,Q35984619
Menagerie: A text-mining tool to support animal-human translation in neurodegeneration research,Q92043520
Automatic annotation of protein residues in published papers,Q91186622
Cell Types Promoting Goosebumps Form a Niche to Regulate Hair Follicle Stem Cells,Q97557008
"High-Dimensional Single-Cell Mapping of Central Nervous System Immune Cells Reveals Distinct Myeloid Subsets in Health, Aging, and Disease.",Q51760951
"High-Dimensional Single-Cell Mapping of Central Nervous System Immune Cells Reveals Distinct Myeloid Subsets in Health, Aging, and Disease.",Q50092192
"The Zebrafish Information Network: new support for non-coding genes, richer Gene Ontology annotations and the Alliance of Genome Resources",Q58587083
The Sequence Ontology: a tool for the unification of genome annotations,Q21092875
Parts of Animals,Q1180725
History of Animals,Q1620799
Perspectives on defining cell types in the brain,Q90361677
Tools and Concepts for Interrogating and Defining Cellular Identity,Q94585630
A method for increasing expressivity of Gene Ontology annotations using a compositional approach.,Q33690250
Funding knowledgebases: Towards a sustainable funding model for the UniProt use case.,Q47732789
A single-cell atlas of the airway epithelium reveals the CFTR-rich pulmonary ionocyte,Q57318689
"Measuring the quality of scientific references in Wikipedia: an analysis of more than 115M citations to over 800,000 scientific articles",Q100766127
Allergic inflammatory memory in human respiratory epithelial progenitor cells,Q59050242
Big data: Wikiomics,Q28292893
BioDash: a Semantic Web dashboard for drug development.,Q38402355
Bioinformatics Data Skills,Q105756183
Neuronal cell types and connectivity: lessons from the retina,Q27021497
Classifying Drosophila Olfactory Projection Neuron Subtypes by Single-Cell RNA Sequencing.,Q47391265
Relations in biomedical ontologies,Q19671539
"Ensembles, dynamics, and cell types: Revisiting the statistical mechanics perspective on cellular regulation",Q91316993
A Taxonomy of Part-Whole Relations,Q54248976
Determining Relative Dynamic Stability of Cell States Using Boolean Network Model,Q58787036
A guide to best practices for Gene Ontology (GO) manual annotation.,Q36997786
Cross-product extensions of the Gene Ontology.,Q34020884
KG-COVID-19: a framework to produce customized knowledge graphs for COVID-19 response,Q102043840
"Classification, Ontology, and Precision Medicine",Q57281359
Supervised clustering for single-cell analysis,Q90003298
Supervised classification enables rapid annotation of cell atlases,Q90003307
Probabilistic cell-type assignment of single-cell RNA-seq for tumor microenvironment profiling,Q90003401
Q392754: Criação de perfis académicos com Wikidata e Scholia – projecto-piloto,Q79377124
The emergence of Semantic Systems Biology.,Q38060960
RDFScape: Semantic Web meets systems biology.,Q33331997
The application of the open pharmacological concepts triple store (Open PHACTS) to support drug discovery research,Q19845588
Representing and querying disease networks using graph databases,Q26741378
Cell-type-based analysis of microRNA profiles in the mouse brain.,Q35725749
A flagellate-to-amoeboid switch in the closest living relatives of animals,Q105870433
A behind the scenes tour of the IEDB curation process: an optimized process empirically integrating automation and human curation efforts,Q96947357
Manual curation is not sufficient for annotation of genomic databases,Q34655326
"Evolution of cellular diversity in primary motor cortex of human, marmoset monkey, and mouse",Q105870478
A taxonomy of transcriptomic cell types across the isocortex and hippocampal formation,Q105870479
Capturing scientific knowledge in computable form,Q105969725
Text mining meets community curation: a newly designed curation platform to improve author experience and participation at WormBase,Q90415774
"Replacement of an Essentialistic Perspective on Taxonomic Definitions as Exemplified by the Definition of ""Mammalia""",Q105870481
Metabolic stability and epigenesis in randomly constructed genetic nets,Q28256189
Biodynamic ontology: applying BFO in the biomedical domain.,Q38520561
Tecnologias da web semântica para a recuperação da informação no wikidata,Q97090036
Q106114584,Q106114584
Biomedical articles share annotations with their citation neighbors,Q105870538
WikiUMLS: Aligning UMLS to Wikipedia via Cross-lingual Neural Ranking,Q105870539
ABDUCTIVE REASONING: A CONTRIBUTION TO KNOWLEDGE CREATION IN EDUCATION,Q105870540
Comunicação entre sistemas de informação médicos,Q106121070
Single-cell proteo-genomic reference maps of the hematopoietic system enable the purification and massive profiling of precisely defined cell states,Q106143534
DisGeNET-RDF: harnessing the innovative power of the Semantic Web to explore the genetic basis of diseases,Q57002691
The markup is the model: reasoning about systems biology models in the Semantic Web era,Q28259568
Automated cell-type classification in intact tissues by single-cell molecular profiling.,Q48262342
"Single-cell expression profiling reveals dynamic flux of cardiac stromal, vascular and immune cells in health and injury",Q64117530
SBOL-OWL: An Ontological Approach for Formal and Semantic Representation of Synthetic Biology Information,Q91791013
SynBioHub: A Standards-Enabled Design Repository for Synthetic Biology.,Q47566455
"Identification of an inhibitory neuron subtype, the L-stellate cell of the cochlear nucleus",Q101212121
Single cell transcriptional signatures of the human placenta in term and preterm parturition,Q83224730
"The SBOL Stack: A Platform for Storing, Publishing, and Sharing Synthetic Biology Designs.",Q36042745
The biocurator: connecting and enhancing scientific data,Q21092581
EKLF/KLF1 expression defines a unique macrophage subset during mouse erythropoiesis,Q106234628
Decoding human fetal liver haematopoiesis,Q90617724
Community annotation and bioinformatics workforce development in concert--Little Skate Genome Annotation Workshops and Jamborees.,Q30427789
BioCreative-IV virtual issue.,Q42584832
"Why data citation isn't working, and what to do about it",Q94522308
On expert curation and scalability: UniProtKB/Swiss-Prot as a case study.,Q47313936
Community next steps for making globally unique identifiers work for biocollections data,Q22676264
Q106248504,Q106248504
Single-cell transcriptomic evidence for dense intracortical neuropeptide networks,Q83226392
Painel de informação sobre a COVID-19: consultas SPARQL na Wikidata,Q106249454
FAIR and open multilingual clinical trials in Wikidata and Wikipedia,Q106235601
Introducing meta-services for biomedical information extraction,Q36920197
Improving Text Mining with Controlled Natural Language: A Case Study for Protein Interactions,Q57402195
An atlas of cell types in the mammalian epididymis and vas deferens,Q98166912
Spatiotemporal analysis of human intestinal development at single-cell resolution,Q104754414
On the role of knowledge graphs in explainable AI,Q98792615
The impact of focused Gene Ontology curation of specific mammalian systems,Q34102856
Single cell RNA sequencing of human liver reveals distinct intrahepatic macrophage populations,Q57804774
An overview of the intrathymic intricacies of T cell development,Q26862512
Use of Gene Ontology Annotation to understand the peroxisome proteome in humans,Q36543290
Editorial: biological ontologies and semantic biology,Q38435922
Semantic systems biology,Q57002913
Fate mapping analysis reveals a novel murine dermal migratory Langerhans-like cell population,Q106354969
Specification of diverse cell types during early neurogenesis of the mouse cerebellum,Q64261872
A cell atlas of human thymic development defines T cell repertoire formation,Q89808480
Single-cell transcriptomics of the mouse kidney reveals potential cellular targets of kidney disease.,Q52603808
"Molecular, spatial and functional single-cell profiling of the hypothalamic preoptic region",Q58577965
"Semantic Systems Biology: Formal Knowledge Representation in Systems Biology for Model Construction, Retrieval, Validation and Discovery",Q56915551
Querying biomedical Linked Data with natural language questions,Q105870677
Q106369750,Q106369750
A competency question-oriented approach for the transformation of semi-structured bioinformatics data into linked open data,Q105870679
Ontologies for the life sciences,Q105870680
Single-Cell Transcriptomics Reveals that Differentiation and Spatial Signatures Shape Epidermal and Hair Follicle Heterogeneity.,Q37314462
Distinct developmental pathways from blood monocytes generate human lung macrophage diversity,Q104684648
A single-cell survey of the small intestinal epithelium.,Q47564808
The Ontology for Parasite Lifecycle (OPL): towards a consistent vocabulary of lifecycle stages in parasitic organisms,Q36368053
A single-cell transcriptomic atlas characterizes ageing tissues in the mouse,Q97569253
On the Application of Formal Principles to Life Science Data: a Case Study in the Gene Ontology,Q105870682
Crowdsourcing biomedical research: leveraging communities as innovation engines,Q27887654
Textpresso: an ontology-based information retrieval and extraction system for biological literature,Q24793009
openSNP--a crowdsourced web resource for personal genomics,Q28657448
Much more than a mere technology: A systematic review of Wikidata in libraries,Q105429450
Open Natural Products Research: Curation and Dissemination of Biological Occurrences of Chemical Structures through Wikidata,Q105742243
Ten Simple Rules for Developing Public Biological Databases,Q28595967
Syntactic analyses and named entity recognition for PubMed and PubMed Central — up-to-the-minute,Q105870783
COVID-19 immune features revealed by a large-scale single-cell transcriptome atlas,Q106315467
The Human Cell Atlas.,Q46368626
Molecular Architecture of the Mouse Nervous System,Q58793343
"Two physically, functionally, and developmentally distinct peritoneal macrophage subsets.",Q33664675
BioBERT: a pre-trained biomedical language representation model for biomedical text mining,Q90006632
BioGPS: building your own mash-up of gene annotations and expression profiles.,Q29169145
Single-cell reconstruction of the early maternal–fetal interface in humans,Q59068540
High-performance web services for querying gene and variant annotation,Q27943213
Text mining resources for the life sciences.,Q28076577
Conserved cell types with divergent features in human versus mouse cortex,Q71306466
Systematic Comparison of High-throughput Single-Cell and Single-Nucleus Transcriptomes during Cardiomyocyte Differentiation,Q89454854
Distinct microbial and immune niches of the human colon,Q89748559
Cochlear hair cell regeneration after noise-induced hearing loss: Does regeneration follow development?,Q39062528
APICURON: a database to credit and acknowledge the work of biocurators,Q106486134
CIViC is a community knowledgebase for expert crowdsourcing the clinical interpretation of variants in cancer,Q29178984
Single cell dissection of plasma cell heterogeneity in symptomatic and asymptomatic myeloma,Q90318029
Single-Cell Transcriptomic Analysis of Human Lung Provides Insights into the Pathobiology of Pulmonary Fibrosis,Q90565414
Mining data and metadata from the gene expression omnibus,Q64119088
"Sharing biological data: why, when, and how",Q106498418
Resolving the fibrotic niche of human liver cirrhosis at single-cell level,Q90612750
SARS-CoV-2 receptor ACE2 and TMPRSS2 are primarily expressed in bronchial transient secretory cells,Q91561671
Nuclei multiplexing with barcoded antibodies for single-nucleus genomics,Q91564696
A human liver cell atlas reveals heterogeneity and epithelial progenitors,Q91776824
Pressing needs of biomedical text mining in biocuration and beyond: opportunities and challenges,Q36233671
Integrating text mining into the MGI biocuration workflow,Q33554526
Accelerating literature curation with text-mining tools: a case study of using PubTator to curate genes in PubMed abstracts.,Q34480402
Collaborative biocuration--text-mining development task for document prioritization for curation,Q36418100
Discovering biomedical semantic relations in PubMed queries for information retrieval and database curation,Q35970872
TeamTat: a collaborative text annotation tool,Q94561368
Automated assessment of biological database assertions using the scientific literature.,Q65002314
LitSense: making sense of biomedical literature at sentence level,Q90290716
Semi-automated ontology generation within OBO-Edit,Q28751720
Toward a Common Coordinate Framework for the Human Body,Q91960464
"scRNA-seq assessment of the human lung, spleen, and esophagus tissue stability after cold preservation",Q92354852
Characterization of cell fate probabilities in single-cell data with Palantir,Q92539085
A single-cell transcriptome atlas of the adult human retina,Q92766837
A cellular census of human lungs identifies novel cell states in health and in asthma,Q92826478
The Confidence Information Ontology: a step towards a standard for asserting confidence in annotations,Q28647782
Knowledge engineering tools for reasoning with scientific observations and interpretations: a neural connectivity use case.,Q35221928
A functional map for diverse forelimb actions within brainstem circuitry,Q106534301
Cell-type-specific asynchronous modulation of PKA by dopamine in learning,Q106534414
In situ mapping identifies distinct vascular niches for myelopoiesis,Q106534530
Gut-licensed IFNγ NK cells drive LAMP1TRAIL anti-inflammatory astrocytes,Q106535191
SARS-CoV-2 entry factors are highly expressed in nasal epithelial cells together with innate immune genes,Q93196405
Systematic comparison of single-cell and single-nucleus RNA-sequencing methods,Q93270907
MyMiner: a web application for computer-assisted biocuration and text annotation.,Q47391302
GEOMetaCuration: a web-based application for accurate manual curation of Gene Expression Omnibus metadata.,Q55407135
Accelerating annotation of articles via automated approaches: evaluation of the neXtA5 curation-support tool by neXtProt,Q60302044
BioCreative III interactive task: an overview,Q34094645
Dissecting the multicellular ecosystem of metastatic melanoma by single-cell RNA-seq,Q37094024
Single-cell analysis reveals new evolutionary complexity in uveal melanoma,Q92932258
Biocuration workflows and text mining: overview of the BioCreative 2012 Workshop Track II,Q28711453
Wikipedia citations: A comprehensive data set of citations with identifiers extracted from English Wikipedia,Q106570089
"Why and how medical schools, peer-reviewed journals, and research funders should promote Wikipedia editing",Q90535817
Medical journals and Wikipedia: a global health matter.,Q27480279
A single-cell and single-nucleus RNA-Seq toolbox for fresh and frozen human tumors,Q94671894
SARS-CoV-2 Receptor ACE2 Is an Interferon-Stimulated Gene in Human Airway Epithelial Cells and Is Detected in Specific Cell Subsets across Tissues,Q94938805
An overview of the BioCreative 2012 Workshop Track III: interactive text mining task.,Q36761979
Overview of the interactive task in BioCreative V,Q30002351
MIFlowCyt: the minimum information about a Flow Cytometry Experiment,Q24644748
Promoting coherent minimum reporting guidelines for biological and biomedical investigations: the MIBBI project,Q29301289
Standardizing the standards,Q95815991
Cells and gene expression programs in the adult human heart,Q95602396
